Year,Title,Authors,CitationsJuly2018,Domain,Definition
2013,A close look on n-grams in intrusion detection: anomaly detection vs. classification,"Christian Wressnegger, Guido Schwenk, Daniel Arp, Konrad Rieck",56,ids,n/a
2013,Network anomaly detection: A survey and comparative analysis of stochastic and deterministic methods,"Jing Wang, Daniel Rossell, Christos G. Cassandras, Ioannis Ch. Paschalidis",22,ids,n/a
2013,Anomaly Detection in IaaS Clouds,"Frank Dölitzscher, Martin Knahl, Christoph Reich, Nathan L. Clarke",23,ids,model
2013,An adaptive flow counting method for anomaly detection in SDN,Ying Zhang,107,ids,rule
2013,"Profile-Based, Load-Independent Anomaly Detection and Analysis in Performance Regression Testing of Software Systems","Shadi Ghaith, Miao Wang, Philip Perry, John Murphy",21,fault,similarity
2013,Object-Centric Anomaly Detection by Attribute-Based Reasoning,"Babak Saleh, Ali Farhadi, Ahmed M. Elgammal",36,cross,likelihood
2013,Anomaly Detection via One Class SVM for Protection of SCADA Systems,"Jianmin Jiang, Lasith Yasakethu",20,ids,model
2013,Machine learning-based anomaly detection for post-silicon bug diagnosis,"Andrew DeOrio, Qingkun Li, Matthew Burgess, Valeria Bertacco",25,fault,cluster
2013,An improved anomaly detection and diagnosis framework for mobile network operators,Szabolcs Nováczki,37,fault,likelihood
2013,Network traffic anomaly detection based on growing hierarchical SOM,"Shin-Ying Huang, Yennun Huang",20,ids,model
2013,Sensor fault and patient anomaly detection and classification in medical wireless sensor networks,"Osman Salem, Alexey Guerassimov, Ahmed Mehaoua, Anthony Marcus, Borko Furht",43,health,model
2013,Flow-Based Anomaly Detection Using Neural Network Optimized with GSA Algorithm,"Zahra Jadidi, Vallipuram Muthukkumarasamy, Elankayer Sithirasenan, Mansour Sheikhan",37,ids,model
2013,Outlier Detection in Non-intrusive ECG Biometric System,"André Lourenço, Hugo Silva, Carlos Carreiras, Ana L. N. Fred",27,health,similarity
2013,Anomaly detection in time series data using a fuzzy c-means clustering,"Hesam Izakian, Witold Pedrycz",28,cross,cluster
2013,One-Class Conditional Random Fields for Sequential Anomaly Detection,"Yale Song, Zhen Wen, Ching-Yung Lin, Randall Davis",22,cross,likelihood
2013,Mobile Network Anomaly Detection and Mitigation: The NEMESYS Approach,"Omer H. Abdelrahman, Erol Gelenbe, Gökçe Görbil, Boris Oklander",35,ids,n/a
2013,"Efficient anomaly detection in dynamic, attributed graphs: Emerging phenomena and big data","Benjamin A. Miller, Nicholas Arcolano, Nadya T. Bliss",31,cross,likelihood
2013,A host-based anomaly detection approach by representing system calls as states of kernel modules,"Syed Shariyar Murtaza, Wael Khreich, Abdelwahab Hamou-Lhadj, Mario Couture",28,ids,likelihood
2013,Subsampling for efficient and effective unsupervised outlier detection ensembles,"Arthur Zimek, Matthew Gaudet, Ricardo J. G. B. Campello, Jörg Sander",80,cross,similarity
2013,Sparse coding with anomaly detection,"Amir Adler, Michael Elad, Yacov Hel-Or, Ehud Rivlin",47,cross,model
2013,Near-optimal Anomaly Detection in Graphs using Lovasz Extended Scan Statistic,"James Sharpnack, Akshay Krishnamurthy, Aarti Singh",33,cross,likelihood
2013,Rapid Distance-Based Outlier Detection via Sampling,"Mahito Sugiyama, Karsten M. Borgwardt",44,cross,similarity
2013,Local Outlier Detection with Interpretation,"Xuan-Hong Dang, Barbora Micenková, Ira Assent, Raymond T. Ng",20,cross,similarity
2013,Community Distribution Outlier Detection in Heterogeneous Information Networks,"Manish Gupta, Jing Gao, Jiawei Han",29,cross,cluster
2013,CMI: An Information-Theoretic Contrast Measure for Enhancing Subspace Cluster and Outlier Detection,"Klemens Böhm, Fabian Keller, Emmanuel Müller, Hoang Vu Nguyen, Jilles Vreeken",36,cross,similarity
2013,k-means-: A Unified Approach to Clustering and Outlier Detection,"Sanjay Chawla, Aristides Gionis",87,cross,cluster
2013,Instance-based Anomaly Method for Android Malware Detection,"Borja Sanz, Igor Santos, Xabier Ugarte-Pedrero, Carlos Laorden, Javier Nieves, Pablo García Bringas",20,ids,similarity
2013,Continuous outlier detection in data streams: an extensible framework and state-of-the-art algorithms,"Dimitrios Georgiadis, Maria Kontaki, Anastasios Gounaris, Apostolos N. Papadopoulos, Kostas Tsichlas, Yannis Manolopoulos",21,cross,similarity
2013,A Robust Anomaly Detection in Pantograph-Catenary System Based on Mean-Shift Tracking and Foreground Detection,"Ilhan Aydin, Mehmet Karaköse, Erhan Akin",30,fault,likelihood
2013,One-Class Support Measure Machines for Group Anomaly Detection,"Krikamol Muandet, Bernhard Schölkopf",37,cross,likelihood
2013,"Anomaly, event, and fraud detection in large network datasets","Leman Akoglu, Christos Faloutsos",29,cross,n/a
2013,A Methodological Overview on Anomaly Detection,"Christian Callegari, Angelo Coluccia, Alessandro D'Alconzo, Wendy Ellens, Stefano Giordano, Michel Mandjes, Michele Pagano, Teresa Pepe, Fabio Ricciato, Piotr Zuraniewski",27,ids,n/a
2013,Entropy based Anomaly Detection System to Prevent DDoS Attacks in Cloud,"A. S. Syed Navaz, V. Sangeetha, C. Prabhadevi",60,ids,likelihood
2014,Outlier Detection for Temporal Data,"Manish Gupta, Jing Gao, Charu C. Aggarwal, Jiawei Han",103,cross,n/a
2014,Anomaly detection/detectability for a linear model with a bounded nuisance parameter,"Fouzi Harrou, Lionel Fillatre, Igor V. Nikiforov",20,fault,likelihood
2014,Anomaly detection for visual analytics of power consumption data,"Halldór Janetzko, Florian Stoffel, Sebastian Mittelstädt, Daniel A. Keim",31,sense,n/a
2014,Visual Analysis of Time-Series Similarities for Anomaly Detection in Sensor Networks,"Martin Steiger, Jürgen Bernard, Sebastian Mittelstädt, Hendrik Lücke-Tieke, Daniel A. Keim, Thorsten May, Jörn Kohlhammer",32,sense,similarity
2014,Combining OpenFlow and sFlow for an effective and scalable anomaly detection and mitigation mechanism on SDN environments,"Kostas Giotis, Christos Argyropoulos, Georgios Androulidakis, Dimitrios Kalogeras, Vasilis Maglaris",178,ids,likelihood
2014,An unsupervised anomaly-based detection approach for integrity attacks on SCADA systems,"Abdulmohsen Almalawi, Xinghuo Yu, Zahir Tari, Adil Fahad, Ibrahim Khalil",39,ids,cluster
2014,"Network Anomaly Detection: Methods, Systems and Tools","Monowar H. Bhuyan, D. K. Bhattacharyya, Jugal K. Kalita",391,ids,n/a
2014,Anomaly Detection in Wireless Sensor Networks in a Non-Stationary Environment,"Colin O'Reilly, Alexander Gluhak, Muhammad Ali Imran, Sutharshan Rajasegarar",36,sense,n/a
2014,A distributed approach to network anomaly detection based on independent component analysis,"Francesco Palmieri, Ugo Fiore, Aniello Castiglione",63,ids,model
2014,Anomaly detection in large-scale data stream networks,"Duc-Son Pham, Svetha Venkatesh, Mihai Lazarescu, Budhaditya Saha",39,cross,model
2014,"Local outlier detection reconsidered: a generalized view on locality with applications to spatial, video, and network outlier detection","Erich Schubert, Arthur Zimek, Hans-Peter Kriegel",118,cross,n/a
2014,Discrete shearlet transform on GPU with applications in anomaly detection and denoising,"Xavier Gibert, Vishal M. Patel, Demetrio Labate, Rama Chellappa",26,remote,model
2014,A novel hybrid intrusion detection method integrating anomaly detection with misuse detection,"Gisung Kim, Seungmin Lee, Sehun Kim",180,ids,model
2014,Anomaly detection in vessel tracks using Bayesian networks,"Steven Mascaro, Ann E. Nicholson, Kevin B. Korb",71,gis,likelihood
2014,Improving PCA-based anomaly detection by using multiple time scale analysis and Kullback-Leibler divergence,"Christian Callegari, Loris Gazzarrini, Stefano Giordano, Michele Pagano, Teresa Pepe",30,ids,model
2014,Anomaly Detection in Medical Wireless Sensor Networks using SVM and Linear Regression Models,"Osman Salem, Alexey Guerassimov, Ahmed Mehaoua, Anthony Marcus, Borko Furht",22,health,model
2014,Video anomaly detection based on a hierarchical activity discovery within spatio-temporal contexts,"Dan Xu, Rui Song, Xinyu Wu, Nannan Li, Wei Feng, Huihuan Qian",38,remote,likelihood
2014,Outlier detection in audit logs for application systems,"Horacio D. Kuna, Ramón García-Martínez, Francisco R. Villatoro",22,others,n/a
2014,Anomaly secure detection methods by analyzing dynamic characteristics of the network traffic in cloud communications,"Wei Xiong, Hanping Hu, Naixue Xiong, Laurence T. Yang, Wen-Chih Peng, Xiaofei Wang, Yanzhen Qu",41,ids,model
2014,Adaptive fuzzy clustering based anomaly data detection in energy system of steel industry,"Jun Zhao, Kai Liu, Wei Wang, Ying Liu",22,fault,similarity
2014,A transform domain-based anomaly detection approach to network-wide traffic,"Dingde Jiang, Zhengzheng Xu, Peng Zhang, Ting Zhu",112,ids,model
2014,Anomaly Detection in Computer Networks: A State-of-the-Art Review,"Sherenaz W. Al-Haj Baddar, Alessio Merlo, Mauro Migliardi",23,ids,n/a
2014,Hyperspherical cluster based distributed anomaly detection in wireless sensor networks,"Sutharshan Rajasegarar, Christopher Leckie, Marimuthu Palaniswami",47,sense,cluster
2014,Workload-aware anomaly detection for Web applications,"Tao Wang, Jun Wei, Wenbo Zhang, Hua Zhong, Tao Huang",28,fault,similarity
2014,Feature selection by multi-objective optimisation: Application to network anomaly detection by hierarchical self-organising maps,"Emiro de la Hoz Franco, Eduardo de la Hoz Correa, Andrés Ortiz, Julio Ortega, Antonio Martínez-Álvarez",59,ids,model
2014,Robust outlier detection using the instability factor,"Jihyun Ha, Seulgi Seok, Jong-Seok Lee",22,cross,similarity
2014,Local Sparsity Divergence for Hyperspectral Anomaly Detection,"Zongze Yuan, Hao Sun, Kefeng Ji, Zhiyong Li, Huanxin Zou",28,remote,model
2014,Two-stage online inference model for traffic pattern analysis and anomaly detection,"Hawook Jeong, Young Joon Yoo, Kwang Moo Yi, Jin Young Choi",21,gis,likelihood
2014,Flow-based anomaly detection in high-speed links using modified GSA-optimized neural network,"Mansour Sheikhan, Zahra Jadidi",32,ids,model
2014,Domain Anomaly Detection in Machine Perception: A System Architecture and Taxonomy,"Josef Kittler, William J. Christmas, Teofilo de Campos, David Windridge, Fei Yan, John Illingworth, Magda Osman",23,cross,likelihood
2014,Online Learning and Sequential Anomaly Detection in Trajectories,"Rikard Laxhammar, Göran Falkman",47,cross,likelihood
2014,Anomaly Detection and Localization in Crowded Scenes,"Weixin Li, Vijay Mahadevan, Nuno Vasconcelos",272,remote,likelihood
2014,Entropy-based outlier detection using semi-supervised approach with few positive examples,"Armin Daneshpazhouh, Ashkan Sami",35,cross,likelihood
2014,Contextual anomaly detection in crowded surveillance scenes,"Michael J. V. Leach, Ed P. Sparks, Neil Martin Robertson",29,remote,similarity
2014,A least-squares approach to anomaly detection in static and sequential data,"John A. Quinn, Masashi Sugiyama",27,cross,likelihood
2014,Anomaly detection in online social networks,"David Savage, Xiuzhen Zhang, Xinghuo Yu, Pauline Lienhua Chou, Qingmai Wang",82,cross,n/a
2014,Real-time causal processing of anomaly detection for hyperspectral imagery,"Shih-Yu Chen, Yulei Wang, Chao-Cheng Wu, Chunhong Liu, Chein-I Chang",26,remote,likelihood
2014,Adaptive Sparse Representations for Video Anomaly Detection,"Xuan Mo, Vishal Monga, Raja Bala, Zhigang Fan",52,remote,model
2014,A Framework for Periodic Outlier Pattern Detection in Time-Series Sequences,"Faraz Rasheed, Reda Alhajj",26,cross,frequency
2014,Anomaly Detection and Characterization in Spatial Time Series Data: A Cluster-Centric Approach,"Hesam Izakian, Witold Pedrycz",33,cross,cluster
2014,A Discriminative Metric Learning Based Anomaly Detection Method,"Bo Du, Liangpei Zhang",144,remote,model
2014,Ship Detection in High-Resolution Optical Imagery Based on Anomaly Detector and Local Shape Feature,"Zhenwei Shi, Xinran Yu, Zhiguo Jiang, Bo Li",61,gis,model
2014,Anomaly Detection of Light-Emitting Diodes Using the Similarity-Based Metric Test,"Moon-Hwan Chang, Chaochao Chen, Diganta Das, Michael G. Pecht",24,fault,cluster
2014,Mining Building Energy Management System Data Using Fuzzy Anomaly Detection and Linguistic Descriptions,"Dumidu Wijayasekara, Ondrej Linda, Milos Manic, Craig G. Rieger",53,fault,cluster
2014,Online Anomaly Detection in Wireless Body Area Networks for Reliable Healthcare Monitoring,"Osman Salem, Yaning Liu, Ahmed Mehaoua, Raouf Boutaba",30,health,model
2014,"Rough Sets, Kernel Set, and Spatiotemporal Outlier Detection","Alessia Albanese, Sankar K. Pal, Alfredo Petrosino",39,cross,similarity
2014,Outlier Detection for Temporal Data: A Survey,"Manish Gupta, Jing Gao, Charu C. Aggarwal, Jiawei Han",278,cross,n/a
2014,An Efficient Approach for Outlier Detection with Imperfect Data Labels,"Bo Liu, Yanshan Xiao, Philip S. Yu, Zhifeng Hao, Longbing Cao",38,cross,n/a
2014,Discovering Emerging Topics in Social Streams via Link-Anomaly Detection,"Toshimitsu Takahashi, Ryota Tomioka, Kenji Yamanishi",48,cross,likelihood
2014,An Online Outlier Identification and Removal Scheme for Improving Fault Detection Performance,"Hasan Ferdowsi, Sarangapani Jagannathan, Maciej J. Zawodniok",22,fault,model
2014,Multicamera video summarization and anomaly detection from activity motifs,"Carter De Leo, Bangalore S. Manjunath",25,remote,likelihood
2014,Integrated Anomaly Detection for Cyber Security of the Substations,"Junho Hong, Chen-Ching Liu, Manimaran Govindarasu",61,ids,frequency
2014,Locality Statistics for Anomaly Detection in Time Series of Graphs,"Heng Wang, Minh Tang, Youngser Park, Carey E. Priebe",53,cross,likelihood
2014,Outlier detection from large distributed databases,"Ji Zhang, Xiaohui Tao, Hua Wang",21,cross,similarity
2014,Mention-anomaly-based Event Detection and tracking in Twitter,"Adrien Guille, Cécile Favre",36,cross,frequency
2014,Contextual Anomaly Detection in Big Sensor Data,"Michael A. Hayes, Miriam A. M. Capretz",37,cross,likelihood
2014,Temporal Anomaly Detection in Business Processes,"Andreas Rogge-Solti, Gjergji Kasneci",23,others,likelihood
2014,Anomaly detection in cyber-physical systems: A formal methods approach,"Austin Jones, Zhaodan Kong, Calin Belta",28,cross,model
2014,Spark-based anomaly detection over multi-source VMware performance data in real-time,"Mohiuddin Solaimani, Mohammed Iftekhar, Latifur Khan, Bhavani M. Thuraisingham, Joey Burton Ingram",24,fault,cluster
2014,Assessing the impact of intra-cloud live migration on anomaly detection,"Noor-ul-Hassan Shirazi, Steven Simpson, Angelos K. Marnerides, Michael R. Watson, Andreas Mauthe, David Hutchison",20,ids,n/a
2014,Analysis of HTTP Requests for Anomaly Detection of Web Attacks,"Mikhail Zolotukhin, Timo Hämäläinen, Tero Kokkonen, Jarmo Siltanen",29,ids,model
2014,Anomaly detection based on eccentricity analysis,Plamen Angelov,35,cross,likelihood
2014,Identifying Wrong Links between Datasets by Multi-dimensional Outlier Detection,Heiko Paulheim,25,cross,n/a
2014,Leveraging SDN for Efficient Anomaly Detection and Mitigation on Legacy Networks,"Kostas Giotis, Georgios Androulidakis, Vasilis Maglaris",39,ids,frequency
2014,A Novel Technique for Long-Term Anomaly Detection in the Cloud,"Owen Vallis, Jordan Hochenbaum, Arun Kejariwal",69,fault,likelihood
2014,Spectral anomaly detection using graph-based filtering for wireless sensor networks,"Hilmi Enes Egilmez, Antonio Ortega",34,sense,model
2014,Scalable distance-based outlier detection over high-volume data streams,"Lei Cao, Di Yang, Qingyang Wang, Yanwei Yu, Jiayuan Wang, Elke A. Rundensteiner",38,cross,similarity
2014,RS-Forest: A Rapid Density Estimator for Streaming Anomaly Detection,"Ke Wu, Kun Zhang, Wei Fan, Andrea Edwards, Philip S. Yu",30,cross,similarity
2014,Tackling the Big Data 4 vs for anomaly detection,"José Camacho, Gabriel Maciá-Fernández, Jesús E. Díaz-Verdejo, Pedro Garcia-Teodoro",28,cross,model
2014,Hashdoop: A MapReduce framework for network anomaly detection,"Romain Fontugne, Johan Mazel, Kensuke Fukuda",33,ids,frequency
2014,LD-Sketch: A distributed sketching design for accurate and scalable anomaly detection in network data streams,"Qun Huang, Patrick P. C. Lee",21,ids,frequency
2014,Smart car parking: Temporal clustering and anomaly detection in urban car parking,"Yanxu Zheng, Sutharshan Rajasegarar, Christopher Leckie, Marimuthu Palaniswami",22,gis,cluster
2014,Focused clustering and outlier detection in large attributed graphs,"Bryan Perozzi, Leman Akoglu, Patricia Iglesias Sánchez, Emmanuel Müller",90,cross,cluster
2014,GLAD: group anomaly detection in social media analysis,"Qi Rose Yu, Xinran He, Yan Liu",57,cross,likelihood
2014,Anomaly Detection and Diagnosis for Automatic Radio Network Verification,"Gabriela F. Ciocarlie, Christopher Connolly, Chih-Chieh Cheng, Ulf Lindqvist, Szabolcs Nováczki, Henning Sanneck, Muhammad Naseer ul Islam",21,ids,cluster
2014,On Integrated Clustering and Outlier Detection,"Lionel Ott, Linsey Xiaolin Pang, Fabio Tozeto Ramos, Sanjay Chawla",27,cross,cluster
2014,RoADS: A Road Pavement Monitoring System for Anomaly Detection Using Smart Phones,"Fatjon Seraj, Berend Jan van der Zwaag, Arta Dilo, Tamara Luarasi, Paul J. M. Havinga",34,fault,model
2014,Anomaly Detection Using Autoencoders with Nonlinear Dimensionality Reduction,"Mayu Sakurada, Takehisa Yairi",58,cross,model
2014,Unsupervised Anomaly-Based Malware Detection Using Hardware Features,"Adrian Tang, Simha Sethumadhavan, Salvatore J. Stolfo",77,ids,model
2014,Generalized Outlier Detection with Flexible Kernel Density Estimates,"Erich Schubert, Arthur Zimek, Hans-Peter Kriegel",57,cross,likelihood
2014,Anomaly Detection Using Replicator Neural Networks Trained on Examples of One Class,"Anh Hoang Dau, Victor Ciesielski, Andy Song",21,cross,model
2014,Detecting Errors in Numerical Linked Data Using Cross-Checked Outlier Detection,"Daniel Fleischhacker, Heiko Paulheim, Volha Bryl, Johanna Völker, Christian Bizer",35,cross,likelihood
2014,Robust multivariate autoregression for anomaly detection in dynamic product ratings,"Nikou Günnemann, Stephan Günnemann, Christos Faloutsos",22,cross,likelihood
2015,Characteristics and classification of outlier detection techniques for wireless sensor networks in harsh environments: a survey,"Nauman Shahid, Ijaz Haider Naqvi, Saad Bin Qaisar",35,sense,n/a
2015,One-class support vector machines: analysis of outlier detection for wireless sensor networks in harsh environments,"Nauman Shahid, Ijaz Haider Naqvi, Saad Bin Qaisar",21,sense,model
2015,Improved principal component analysis for anomaly detection: Application to an emergency department,"Fouzi Harrou, Farid Kadri, Sondès Chaabane, Christian Tahon, Ying Sun",32,health,model
2015,A Survey of Distance and Similarity Measures Used Within Network Intrusion Anomaly Detection,"David J. Weller-Fahy, Brett J. Borghetti, Angela A. Sodemann",46,ids,similarity
2015,Performance Anomaly Detection and Bottleneck Identification,"Olumuyiwa Ibidunmoye, Francisco Hernández-Rodriguez, Erik Elmroth",53,fault,n/a
2015,Graph based anomaly detection and description: a survey,"Leman Akoglu, Hanghang Tong, Danai Koutra",352,cross,n/a
2015,Algorithm for the detection of outliers based on the theory of rough sets,"Francisco Maciá Pérez, José Vicente Berná-Martínez, Alberto Fernández Oliva, Miguel Alfonso Abreu Ortega",24,cross,rule
2015,An Entropy-Based Network Anomaly Detection Method,"Przemyslaw Berezinski, Bartosz Jasiul, Marcin Szpyrka",41,ids,likelihood
2015,Anomaly detection using a modified kernel-based tracking in the pantograph-catenary system,"Ilhan Aydin, Mehmet Karaköse, Erhan Akin",22,remote,likelihood
2015,Multi-scale anomaly detection for high-speed network traffic,"Dingde Jiang, Cheng Yao, Zhengzheng Xu, Wenda Qin",29,ids,model
2015,"Control variable classification, modeling and anomaly detection in Modbus/TCP SCADA systems","Noam Erez, Avishai Wool",36,fault,likelihood
2015,A fuzzy anomaly detection system based on hybrid PSO-Kmeans algorithm in content-centric networks,"Amin Karami, Manel Guerrero Zapata",56,cross,cluster
2015,Anomaly detection in traffic using L1-norm minimization extreme learning machine,"Yibing Wang, Dong Li, Yi Du, Zhisong Pan",21,ids,model
2015,Contextual anomaly detection framework for big sensor data,"Michael A. Hayes, Miriam A. M. Capretz",36,sense,likelihood
2015,Online data-driven anomaly detection in autonomous robots,"Eliahu Khalastchi, Meir Kalech, Gal A. Kaminka, Raz Lin",28,fault,likelihood
2015,Robust support vector data description for outlier detection with noise or uncertain data,"Guijun Chen, Xueying Zhang, Zizhong John Wang, Fenglian Li",35,cross,model
2015,Principal Component Reconstruction Error for Hyperspectral Anomaly Detection,"James A. Jablonski, Trevor J. Bihl, Kenneth W. Bauer Jr",22,remote,model
2015,Analysis of network traffic features for anomaly detection,"Félix Iglesias, Tanja Zseby",38,ids,n/a
2015,Outlier detection and robust normal-curvature estimation in mobile laser scanning 3D point cloud data,"Abdul Nurunnabi, Geoff A. W. West, David Belton",51,remote,likelihood
2015,Streaming Anomaly Detection Using Randomized Matrix Sketching,"Hao Huang, Shiva Prasad Kasiviswanathan",21,cross,model
2015,Sensor Anomaly Detection in Wireless Sensor Networks for Healthcare,"Shah Ahsanul Haque, Mustafizur Rahman, Syed Mahfuzul Aziz",28,health,likelihood
2015,Anomaly Detection Based on Sensor Data in Petroleum Industry Applications,"Luis Martí, Nayat Sánchez Pi, José Manuel Molina, Ana Cristina Bicharra Garcia",26,sense,model
2015,Multivariate functional outlier detection,"Mia Hubert, Peter J. Rousseeuw, Pieter Segaert",60,cross,likelihood
2015,"Event detection, tracking, and visualization in Twitter: a mention-anomaly-based approach","Adrien Guille, Cécile Favre",41,cross,frequency
2015,Robust Linear Spectral Unmixing Using Anomaly Detection,"Yoann Altmann, Steve McLaughlin, Alfred Hero",28,remote,likelihood
2015,Adaptive Distributed Outlier Detection for WSNs,"Alessandra De Paola, Salvatore Gaglio, Giuseppe Lo Re, Fabrizio Milazzo, Marco Ortolani",31,sense,likelihood
2015,Online Anomaly Detection in Crowd Scenes via Structure Analysis,"Yuan Yuan, Jianwu Fang, Qi Wang",69,remote,n/a
2015,Evolving Fuzzy Rules for Anomaly Detection in Data Streams,"Masud Moshtaghi, James C. Bezdek, Christopher Leckie, Shanika Karunasekera, Marimuthu Palaniswami",22,cross,rule
2015,Collaborative Representation for Hyperspectral Anomaly Detection,"Wei Li, Qian Du",100,remote,model
2015,Fast Hyperspectral Anomaly Detection via High-Order 2-D Crossing Filter,"Yuan Yuan, Qi Wang, Guokang Zhu",30,remote,model
2015,Distributed Real-Time Anomaly Detection in Networked Industrial Sensing Systems,"Po-Yu Chen, Shusen Yang, Julie A. McCann",32,sense,similarity
2015,Wireless Anomaly Detection Based on IEEE 802.11 Behavior Analysis,"Hamid Alipour, Youssif B. Al-Nashif, Pratik Satam, Salim Hariri",24,ids,frequency
2015,Gaussian Process Regression-Based Video Anomaly Detection and Localization With Hierarchical Feature Representation,"Kai-Wen Cheng, Yie-Tarng Chen, Wen-Hsien Fang",24,remote,likelihood
2015,Active Hypothesis Testing for Anomaly Detection,"Kobi Cohen, Qing Zhao",22,cross,likelihood
2015,"Hierarchical Density Estimates for Data Clustering, Visualization, and Outlier Detection","Ricardo J. G. B. Campello, Davoud Moulavi, Arthur Zimek, Jörg Sander",68,cross,cluster
2015,Reverse Nearest Neighbors in Unsupervised Distance-Based Outlier Detection,"Milos Radovanovic, Alexandros Nanopoulos, Mirjana Ivanovic",58,cross,similarity
2015,Adaptive Hidden Markov Model With Anomaly States for Price Manipulation Detection,"Yi Cao, Yuhua Li, Sonya A. Coleman, Ammar Belatreche, Thomas Martin McGinnity",24,cross,likelihood
2015,Segment-Based Anomaly Detection with Approximated Sample Covariance Matrix in Wireless Sensor Networks,"Miao Xie, Jiankun Hu, Song Guo",20,sense,likelihood
2015,Design and Analysis of Multimodel-Based Anomaly Intrusion Detection Systems in Industrial Process Automation,"Chunjie Zhou, Shuang Huang, Naixue Xiong, Shuang-Hua Yang, Huiyun Li, Yuanqing Qin, Xuan Li",31,fault,rule
2015,"Anomaly-based intrusion detection of jamming attacks, local versus collaborative detection","Alexandros G. Fragkiadakis, Vasilios A. Siris, Nikolaos E. Petroulakis, Apostolos Traganitis",22,ids,likelihood
2015,Online anomaly detection over Big Data streams,"Laura Rettig, Mourad Khayati, Philippe Cudré-Mauroux, Michal Piórkowski",21,cross,likelihood
2015,Schema Extraction and Structural Outlier Detection for JSON-based NoSQL Data Stores,"Meike Klettke, Uta Störl, Stefanie Scherzinger",26,others,n/a
2016,PCA-based multivariate statistical network monitoring for anomaly detection,"José Camacho, Alejandro Pérez-Villegas, Pedro García-Teodoro, Gabriel Maciá-Fernández",24,ids,model
2016,Exploratory security analytics for anomaly detection,"Fabio Pierazzi, Sara Casolari, Michele Colajanni, Mirco Marchetti",17,ids,likelihood
2016,"On the evaluation of unsupervised outlier detection: measures, datasets, and an empirical study","Guilherme O. Campos, Arthur Zimek, Jörg Sander, Ricardo J. G. B. Campello, Barbora Micenková, Erich Schubert, Ira Assent, Michael E. Houle",68,cross,similarity
2016,An efficient proactive artificial immune system based anomaly detection and prevention system,"Praneet Saurabh, Bhupendra Verma",21,cross,similarity
2016,A survey of anomaly detection techniques in financial domain,"Mohiuddin Ahmed, Abdun Naser Mahmood, Md. Rafiqul Islam",52,cross,cluster
