Year,Title,Authors,CitationsJuly2018,Domain,Definition
2011,Spatiotemporal Models for Data-Anomaly Detection in Dynamic Environmental Monitoring Campaigns,"Ethan W. Dereszynski, Thomas G. Dietterich",58,sense,likelihood
2011,Anomaly Detection for Cybersecurity of the Substations,"Chee-Wooi Ten, Junho Hong, Chen-Ching Liu",116,ids,frequency
2011,Privacy-Preserving Outlier Detection Through Random Nonlinear Data Distortion,"Kanishka Bhaduri, Mark D. Stefanski, Ashok N. Srivastava",23,cross,similarity
2011,Robust statistics for outlier detection,"Peter J. Rousseeuw, Mia Hubert",168,cross,n/a
2011,Outlier detection,"Xiaogang Su, Chih-Ling Tsai",24,cross,n/a
2011,Energy Outlier Detection in Smart Environments,"Chao Chen, Diane J. Cook",24,sense,cluster
2011,A Survey of Outlier Detection Methodologies and Their Applications,"Zhixian Niu, Shuping Shi, Jingyu Sun, Xiu He",25,cross,similarity
2011,Textures of optical flow for real-time anomaly detection in crowds,"David Ryan, Simon Denman, Clinton Fookes, Sridha Sridharan",76,remote,likelihood
2011,Fuzzy logic based anomaly detection for embedded network security cyber sensor,"Ondrej Linda, Milos Manic, Todd Vollmer, Jason L. Wright",41,ids,cluster
2011,"Sub-Space clustering, Inter-Clustering Results Association & anomaly correlation for unsupervised network anomaly detection","Johan Mazel, Pedro Casas, Yann Labit, Philippe Owezarski",36,ids,cluster
2011,"Improved anomaly detection in crowded scenes via cell-based analysis of foreground speed, size and texture","Vikas Reddy, Conrad Sanderson, Brian C. Lovell",127,remote,likelihood
2011,An Unbiased Distance-Based Outlier Detection Approach for High-Dimensional Data,"Hoang Vu Nguyen, Vivekanand Gopalkrishnan, Ira Assent",24,cross,similarity
2011,A Neural Network Based Anomaly Intrusion Detection System,"Sufyan T. Faraj Al-Janabi, Hadeel Amjed Saeed",32,ids,model
2011,Anomaly-based intrusion detection in software as a service,"Gustavo Nascimento, Miguel Correia",38,ids,n/a
2011,Sequential Conformal Anomaly Detection in trajectories based on Hausdorff distance,"Rikard Laxhammar, Göran Falkman",37,remote,likelihood
2011,Performance Metric Selection for Autonomic Anomaly Detection on Cloud Computing Systems,Song Fu,44,fault,model
2011,Online Fault and Anomaly Detection for Large-Scale Scientific Workflows,"Taghrid Samak, Dan Gunter, Monte Goode, Ewa Deelman, Gideon Juve, Gaurang Mehta, Fabio Silva, Karan Vahi",24,fault,cluster
2011,Using behavior models for anomaly detection in hybrid systems,"Asmir Vodencarevic, Hans Kleine Büning, Oliver Niggemann, Alexander Maier",35,fault,frequency
2011,A Novel PCA-Based Network Anomaly Detection,"Christian Callegari, Loris Gazzarrini, Stefano Giordano, Michele Pagano, Teresa Pepe",31,ids,model
2011,NADO: network anomaly detection using outlier approach,"Monowar H. Bhuyan, D. K. Bhattacharyya, Jugal K. Kalita",22,ids,cluster
2011,Optimizing interaction force for global anomaly detection in crowded scenes,"R. Raghavendra, Alessio Del Bue, Marco Cristani, Vittorio Murino",64,remote,n/a
2011,Outlier detection in graph streams,"Charu C. Aggarwal, Yuchen Zhao, Philip S. Yu",64,cross,likelihood
2011,"Outlier detection on uncertain data: Objects, instances, and inferences","Bin Jiang, Jian Pei",25,cross,likelihood
2011,Locality Sensitive Outlier Detection: A ranking driven approach,"Ye Wang, Srinivasan Parthasarathy, Shirish Tatikonda",48,cross,cluster
2011,Unsupervised Anomaly Intrusion Detection via Localized Bayesian Feature Selection,"Wentao Fan, Nizar Bouguila, Djemel Ziou",22,ids,likelihood
2011,Incremental Elliptical Boundary Estimation for Anomaly Detection in Wireless Sensor Networks,"Masud Moshtaghi, Christopher Leckie, Shanika Karunasekera, James C. Bezdek, Sutharshan Rajasegarar, Marimuthu Palaniswami",37,sense,likelihood
2011,Discovering Emerging Topics in Social Streams via Link Anomaly Detection,"Toshimitsu Takahashi, Ryota Tomioka, Kenji Yamanishi",46,cross,likelihood
2011,Direct Robust Matrix Factorizatoin for Anomaly Detection,"Liang Xiong, Xi Chen, Jeff G. Schneider",58,cross,model
2011,Anomaly Detection in Production Plants using Timed Automata - Automated Learning of Models from Observations,"Alexander Maier, Oliver Niggemann, Roman Just, Michael Jäger, Asmir Vodencarevic",32,fault,model
2011,Particle-based tracking model for automatic anomaly detection,"Erwan Jouneau, Cyril Carincotte",22,remote,likelihood
2011,The practice on using machine learning for network anomaly intrusion detection,Yu-Xin Meng,30,ids,model
2011,Real-time camera anomaly detection for real-world video surveillance,"Yuan-Kai Wang, Ching-Tang Fan, Ke-Yu Cheng, Peter Shaohua Deng",20,remote,likelihood
2011,Fast Anomaly Detection for Streaming Data,"Swee Chuan Tan, Kai Ming Ting, Fei Tony Liu",69,cross,similarity
2011,Statistical techniques for online anomaly detection in data centers,"Chengwei Wang, Krishnamurthy Viswanathan, Choudur Lakshminarayan, Vanish Talwar, Wade Satterfield, Karsten Schwan",106,fault,likelihood
2011,A comparative study of two network-based anomaly detection methods,"Kaustubh Nyalkalkar, Sushant Sinha, Michael Bailey, Farnam Jahanian",31,ids,model
2011,Entropy-based anomaly detection for in-vehicle networks,"Michael Müter, Naim Asaj",72,sense,likelihood
2011,Algorithms for speeding up distance-based outlier detection,"Kanishka Bhaduri, Bryan L. Matthews, Chris Giannella",62,cross,similarity
2011,UNADA: Unsupervised Network Anomaly Detection Using Sub-space Outliers Ranking,"Pedro Casas, Johan Mazel, Philippe Owezarski",32,ids,cluster
2011,Group Anomaly Detection using Flexible Genre Models,"Liang Xiong, Barnabás Póczos, Jeff G. Schneider",42,cross,likelihood
2011,Cross-Domain Collaborative Anomaly Detection: So Far Yet So Close,"Nathaniel Boggs, Sharath Hiremagalore, Angelos Stavrou, Salvatore J. Stolfo",31,ids,model
2011,Revisiting Traffic Anomaly Detection Using Software Defined Networking,"Syed Akbar Mehdi, Junaid Khalid, Syed Ali Khayam",230,ids,n/a
2011,Non-Negative Residual Matrix Factorization with Application to Graph Anomaly Detection,"Hanghang Tong, Ching-Yung Lin",73,cross,model
2011,Power line carrier (PLC) signal analysis of smart meters for outlier detection,"Rakesh Rao, Srinivas Akella, Gokhan Guley",24,fault,likelihood
2011,A Review of SCADA Anomaly Detection Systems,"Iñaki Garitano, Roberto Uribeetxeberria, Urko Zurutuza",33,ids,n/a
2011,Traffic dispersion graph based anomaly detection,"Do Quoc Le, Taeyoel Jeong, H. Eduardo Roman, James Won-Ki Hong",20,ids,similarity
2011,"Spatial Outlier Detection: Data, Algorithms, Visualizations","Elke Achtert, Ahmed Hettab, Hans-Peter Kriegel, Erich Schubert, Arthur Zimek",31,gis,n/a
2011,The role of visualization and interaction in maritime anomaly detection,"Maria Riveiro, Göran Falkman",22,gis,n/a
2011,TVi: a visual querying system for network monitoring and anomaly detection,"Alberto Boschetti, Luca Salgarelli, Chris Muelder, Kwan-Liu Ma",30,ids,similarity
2011,A graph theoretic approach to anomaly detection in hyperspectral imagery,"David W. Messinger, James Albano",24,remote,similarity
2011,Hierarchical Probabilistic Models for Group Anomaly Detection,"Liang Xiong, Barnabás Póczos, Jeff G. Schneider, Andrew J. Connolly, Jake VanderPlas",49,cross,likelihood
2011,Moving Object Detection by Detecting Contiguous Outliers in the Low-Rank Representation,"Xiaowei Zhou, Can Yang, Weichuan Yu",340,remote,model
2012,Exact Subspace Segmentation and Outlier Detection by Low-Rank Representation,"Guangcan Liu, Huan Xu, Shuicheng Yan",57,remote,model
2012,An intelligent algorithm with feature selection and decision rules applied to anomaly intrusion detection,"Shih-Wei Lin, Kuo-Ching Ying, Chou-Yuan Lee, Zne-Jung Lee",134,ids,model
2012,Outlier Detection in Cross-Context Link Discovery for Creative Literature Mining,"Ingrid Petric, Bojan Cestnik, Nada Lavrac, Tanja Urbancic",24,cross,similarity
2012,Multi-scale and real-time non-parametric approach for anomaly detection and localization,"Marco Bertini, Alberto Del Bimbo, Lorenzo Seidenari",94,remote,likelihood
2012,FRaC: a feature-modeling approach for semi-supervised and unsupervised anomaly detection,"Keith Noto, Carla E. Brodley, Donna K. Slonim",46,cross,likelihood
2012,Statistical and signal-based network traffic recognition for anomaly detection,"Michal Choras, Lukasz Saganowski, Rafal Renk, Witold Holubowicz",32,ids,frequency
2012,An autonomous labeling approach to support vector machines algorithms for network traffic anomaly detection,"Carlos Catania, Facundo Bromberg, Carlos García Garino",40,ids,model
2012,Ensemble based sensing anomaly detection in wireless sensor networks,"Daniel-Ioan Curiac, Constantin Volosencu",37,sense,model
2012,Statistics-based outlier detection for wireless sensor networks,"Y. Zhang, Nicholas A. S. Hamm, Nirvana Meratnia, Alfred Stein, M. van de Voort, Paul J. M. Havinga",101,sense,likelihood
2012,Visual interactive evolutionary algorithm for high dimensional outlier detection and data clustering problems,Lydia Boudjeloud-Assala,20,cross,similarity
2012,AOCD: An Adaptive Outlier Based Coordinated Scan Detection Approach,"Monowar H. Bhuyan, Dhruba K. Bhattacharyya, Jugal K. Kalita",23,ids,cluster
2012,Adaptive Anomaly-Based Intrusion Detection System Using Fuzzy Controller,"Farzaneh Geramiraz, Amir Saman Memaripour, Maghsoud Abbaspour",21,ids,rule
2012,Parallel Misuse and Anomaly Detection Model,"Radhika Goel, Anjali Sardana, Ramesh C. Joshi",29,ids,model
2012,Workflow mining and outlier detection from clinical activity logs,"Loubna Bouarfa, Jenny Dankelman",55,health,similarity
2012,Usage of Modified Holt-Winters Method in the Anomaly Detection of Network Traffic: Case Studies,"Maciej Szmit, Anna Szmit",21,ids,model
2012,Hyperspectral Anomaly Detection: Comparative Evaluation in Scenes with Diverse Complexity,"Dirk Borghys, Ingebjørg Kåsen, Véronique Achard, Christiaan Perneel",21,remote,n/a
2012,Community-based anomaly detection in evolutionary networks,"Zhengzhang Chen, William Hendrix, Nagiza F. Samatova",54,cross,n/a
2012,Security analysis of online centroid anomaly detection,"Marius Kloft, Pavel Laskov",35,ids,cluster
2012,A-GHSOM: An adaptive growing hierarchical self organizing map for network anomaly detection,"Dennis Ippoliti, Xiaobo Zhou",27,ids,model
2012,Density-preserving projections for large-scale local anomaly detection,"Timothy de Vries, Sanjay Chawla, Michael E. Houle",32,cross,similarity
2012,An efficient negative selection algorithm with further training for anomaly detection,"Maoguo Gong, Jian Zhang, Jingjing Ma, Licheng Jiao",71,cross,similarity
2012,Sparse Kernel-Based Hyperspectral Anomaly Detection,"Prudhvi Gurram, Heesung Kwon, Timothy Han",32,cross,model
2012,Outlier detection in high-density surface electromyographic signals,"Hamid R. Marateb, Monica Rojas-Martínez, Marjan Mansourian, Roberto Merletti, Miguel A. Mañanas Villanueva",29,health,similarity
2012,Adaptive ROC-based ensembles of HMMs applied to anomaly detection,"Wael Khreich, Eric Granger, Ali Miri, Robert Sabourin",50,ids,likelihood
2012,A survey on unsupervised outlier detection in high-dimensional numerical data,"Arthur Zimek, Erich Schubert, Hans-Peter Kriegel",254,cross,n/a
2012,Detecting signals of new technological opportunities using semantic patent analysis and outlier detection,"Janghyeok Yoon, Kwangsoo Kim",96,others,similarity
2012,Outlier Detection in Functional Observations With Applications to Profile Monitoring,"Guan Yu, Changliang Zou, Zhaojun Wang",38,cross,likelihood
2012,Large-scale IP network behavior anomaly detection and identification using substructure-based approach and multivariate time series mining,"Weisong He, Guangmin Hu, Yingjie Zhou",21,ids,frequency
2012,Magnetic Anomaly Detection Using High-Order Crossing Method,"Arie Sheinker, Boris Ginzburg, Nizan Salomonski, Phineas A. Dickstein, Lev Frumkis, Ben-Zion Kaplan",30,gis,frequency
2012,Anomaly Detection and Reconstruction From Random Projections,"James E. Fowler, Qian Du",70,remote,model
2012,Sequential Anomaly Detection in the Presence of Noise and Limited Feedback,"Maxim Raginsky, Rebecca M. Willett, Corinne Horn, Jorge G. Silva, Roummel F. Marcia",42,cross,likelihood
2012,Isolation-Based Anomaly Detection,"Fei Tony Liu, Kai Ming Ting, Zhi-Hua Zhou",140,cross,similarity
2012,Anomaly Detection for Discrete Sequences: A Survey,"Varun Chandola, Arindam Banerjee, Vipin Kumar",285,cross,n/a
2012,A Performance Anomaly Detection and Analysis Framework for DBMS Development,"Donghun Lee, Sang K. Cha, Arthur H. Lee",22,fault,likelihood
2012,A Review of Anomaly Detection in Automated Surveillance,"Angela A. Sodemann, Matthew P. Ross, Brett J. Borghetti",85,remote,n/a
2012,A Healthcare Utilization Analysis Framework for Hot Spotting and Contextual Anomaly Detection,"Jianying Hu, Fei Wang, Jimeng Sun, Robert Sorrentino, Shahram Ebadollahi",25,health,similarity
2012,Spatiotemporal anomaly detection through visual analysis of geolocated Twitter messages,"Dennis Thom, Harald Bosch, Steffen Koch, Michael Wörner, Thomas Ertl",123,gis,cluster
2012,Network Anomaly Detection Using Co-clustering,"Evangelos E. Papalexakis, Alex Beutel, Peter Steenkiste",35,ids,cluster
2012,An Ensemble of Rejecting Classifiers for Anomaly Detection of Audio Events,"Donatello Conte, Pasquale Foggia, Gennaro Percannella, Alessia Saggese, Mario Vento",21,remote,model
2012,Aircraft anomaly detection using performance models trained on fleet data,"Dimitry Gorinevsky, Bryan L. Matthews, Rodney Martin",22,fault,model
2012,Fast and reliable anomaly detection in categorical data,"Leman Akoglu, Hanghang Tong, Jilles Vreeken, Christos Faloutsos",54,cross,model
2012,Embedded Cyber-Physical Anomaly Detection in Smart Meters,"Massimiliano Raciti, Simin Nadjm-Tehrani",20,sense,cluster
2012,Video anomaly detection based on local statistical aggregates,"Venkatesh Saligrama, Zhu Chen",154,remote,likelihood
2012,A Contextual Anomaly Detection Approach to Discover Zero-Day Attacks,"Ahmed AlEroud, George Karabatis",23,ids,similarity
2012,AnyOut: Anytime Outlier Detection on Streaming Data,"Ira Assent, Philipp Kranen, Corinna Baldauf, Thomas Seidl",59,cross,cluster
2012,Towards periodicity based anomaly detection in SCADA networks,"Rafael Ramos Regis Barbosa, Ramin Sadre, Aiko Pras",40,ids,model
2012,Detectors Generation using Genetic Algorithm for a Negative Selection Inspired Anomaly Network Intrusion Detection System,"Amira Sayed A. Aziz, Mostafa A. Salama, Aboul Ella Hassanien, Sanaa El-Ola Hanafi",22,ids,similarity
2012,Maritime anomaly detection using Gaussian Process active learning,"Kira Kowalska, Leto Peel",38,gis,likelihood
2012,HTOutlier: Hardware Trojan detection with side-channel signature outlier identification,"Jie Zhang, Haile Yu, Qiang Xu",24,ids,similarity
2012,An effective unsupervised network anomaly detection method,"Monowar H. Bhuyan, D. K. Bhattacharyya, Jugal K. Kalita",26,ids,cluster
2012,An improved Hidden Markov Model for anomaly detection using frequent common patterns,"Afroza Sultana, Abdelwahab Hamou-Lhadj, Mario Couture",20,ids,likelihood
2012,Outlier Detection in Arbitrarily Oriented Subspaces,"Hans-Peter Kriegel, Peer Kröger, Erich Schubert, Arthur Zimek",63,cross,likelihood
2012,Granger Causality for Time-Series Anomaly Detection,"Huida Qiu, Yan Liu, Niranjan A. Subrahmanya, Weichang Li",28,cross,likelihood
2012,Practical anomaly detection based on classifying frequent traffic patterns,"Ignasi Paredes-Oliva, Ismael Castell-Uroz, Pere Barlet-Ros, Xenofontas A. Dimitropoulos, Josep Solé-Pareta",30,ids,model
2012,Robust feature selection and robust PCA for internet traffic anomaly detection,"Cláudia Pascoal, Maria Rosário de Oliveira, Rui Valadas, Peter Filzmoser, Paulo Salvador, António Pacheco",41,ids,model
2012,Argus: End-to-end service anomaly detection and localization from an ISP's point of view,"He Yan, Ashley Flavel, Zihui Ge, Alexandre Gerber, Daniel Massey, Christos Papadopoulos, Hiren Shah, Jennifer Yates",40,ids,frequency
2012,Integrating community matching and outlier detection for mining evolutionary community outliers,"Manish Gupta, Jing Gao, Yizhou Sun, Jiawei Han",88,cross,n/a
2012,A near-linear time approximation algorithm for angle-based outlier detection in high-dimensional data,"Ninh Pham, Rasmus Pagh",78,cross,similarity
2012,Smarter outlier detection and deeper understanding of large-scale taxi trip records: a case study of NYC,Jianting Zhang,20,gis,frequency
2012,Anomaly Teletraffic Intrusion Detection Systems on Hadoop-Based Platforms: A Survey of Some Problems and Solutions,"Hae-Duck Joshua Jeong, WooSeok Hyun, Jiyoung Lim, Ilsun You",23,ids,n/a
2012,Unsupervised Clustering Approach for Network Anomaly Detection,"Iwan Syarif, Adam Prügel-Bennett, Gary Wills",48,ids,cluster
2012,Multi-criteria Anomaly Detection using Pareto Depth Analysis,"Ko-Jen Hsiao, Kevin S. Xu, Jeff Calder, Alfred O. Hero III",30,cross,similarity
2012,Community Trend Outlier Detection Using Soft Temporal Pattern Mining,"Manish Gupta, Jing Gao, Yizhou Sun, Jiawei Han",56,cross,n/a
2012,An automatic satellite image registration technique based on Harris corner detection and Random Sample Consensus (RANSAC) outlier rejection model,"Indranil Misra, S. Manthira Moorthi, Debajyoti Dhar, R. Ramakrishnan",41,remote,likelihood
2012,A hybrid system for reducing the false alarm rate of anomaly intrusion detection system,"Hari Om, Aritra Kundu",84,ids,likelihood
2012,Fast Robustness Estimation in Large Social Graphs: Communities and Anomaly Detection,"Fragkiskos D. Malliaros, Vasileios Megalooikonomou, Christos Faloutsos",25,cross,n/a
2012,User Intention-Based Traffic Dependence Analysis for Anomaly Detection,"Hao Zhang, William Banick, Danfeng Yao, Naren Ramakrishnan",30,ids,model
2012,AAD: Adaptive Anomaly Detection System for Cloud Computing Infrastructures,"Husanbir S. Pannu, Jianguo Liu, Song Fu",25,fault,model
2012,Histogram-Based Online Anomaly Detection in Hierarchical Wireless Sensor Networks,"Miao Xie, Jiankun Hu, Biming Tian",28,sense,likelihood
2012,Wireless Smart Home Sensor Networks: Mobile Agent Based Anomaly Detection,"Muhammad Usman, Vallipuram Muthukkumarasamy, Xin-Wen Wu, Surraya Khanum",22,sense,likelihood
2012,Quarter-Sphere SVM: Attribute and Spatio-Temporal correlations based Outlier & Event Detection in wireless sensor networks,"Nauman Shahid, Ijaz Haider Naqvi, Saad B. Qaisar",37,sense,model
2012,Local Anomaly Detection,"Venkatesh Saligrama, Manqi Zhao",31,cross,likelihood
2012,Anomaly Detection in Water Management Systems,"Massimiliano Raciti, Jordi Cucurull, Simin Nadjm-Tehrani",27,sense,cluster
2013,Distributed online outlier detection in wireless sensor networks using ellipsoidal support vector machine,"Yang Zhang, Nirvana Meratnia, Paul J. M. Havinga",67,sense,model
2013,Distribution-based anomaly detection via generalized likelihood ratio test: A general Maximum Entropy approach,"Angelo Coluccia, Alessandro D'Alconzo, Fabio Ricciato",28,ids,likelihood
2013,ADMIRE: Anomaly detection method using entropy-based PCA with three-step sketches,"Yoshiki Kanda, Romain Fontugne, Kensuke Fukuda, Toshiharu Sugawara",21,ids,model
2013,SIPAD: SIP-VoIP Anomaly Detection using a Stateful Rule Tree,"Dongwon Seo, Heejo Lee, Ejovi Nuwere",27,ids,rule
2013,Statistical wavelet-based anomaly detection in big data with compressive sensing,"Wei Wang, Dunqiang Lu, Xin Zhou, Baoju Zhang, Jiasong M",21,cross,frequency
2013,Vessel Pattern Knowledge Discovery from AIS Data: A Framework for Anomaly Detection and Route Prediction,"Giuliana Pallotta, Michele Vespe, Karna Bryan",177,gis,likelihood
2013,Anomaly detection of cooling fan and fault classification of induction motor using Mahalanobis-Taguchi system,"Xiaohang Jin, Tommy W. S. Chow",39,fault,similarity
2013,Open data for anomaly detection in maritime surveillance,"Samira Kazemi, Shahrooz Abghari, Niklas Lavesson, Henric Johnson, Peter Ryman",36,gis,rule
2013,Network Traffic Features for Anomaly Detection in Specific Industrial Control System Network,"Matti Mantere, Mirko Sailio, Sami Noponen",21,ids,cluster
2013,Spatial outlier detection based on iterative self-organizing learning model,"Qiao Cai, Haibo He, Hong Man",29,gis,cluster
2013,Network anomaly detection with the restricted Boltzmann machine,"Ugo Fiore, Francesco Palmieri, Aniello Castiglione, Alfredo De Santis",117,ids,likelihood
2013,Scalable Anomaly Detection for Smart City Infrastructure Networks,"Djellel Eddine Difallah, Philippe Cudré-Mauroux, Sean A. McKenna",24,sense,similarity
2013,Algorithms for anomaly detection of traces in logs of process aware information systems,"Fábio de Lima Bezerra, Jacques Wainer",33,others,n/a
2013,Enhancing density-based clustering: Parameter reduction and outlier detection,"Carmelo Cassisi, Alfredo Ferro, Rosalba Giugno, Giuseppe Pigola, Alfredo Pulvirenti",56,cross,cluster
2013,Toward a more practical unsupervised anomaly detection system,"Jungsuk Song, Hiroki Takakura, Yasuo Okabe, Koji Nakao",69,ids,cluster
2013,Energy-aware and self-adaptive anomaly detection scheme based on network tomography in mobile ad hoc networks,"Wei Wang, Huiran Wang, Beizhan Wang, Yaping Wang, Jiajun Wang",20,ids,model
2013,Application of density-based outlier detection to database activity monitoring,"Seung Kim, Nam Wook Cho, Youngjoo Lee, Suk-Ho Kang, Taewan Kim, Hyeseon Hwang, Dongseop Mun",20,others,similarity
2013,Toward Supervised Anomaly Detection,"Nico Görnitz, Marius Kloft, Konrad Rieck, Ulf Brefeld",79,cross,model
2013,Outlier detection for patient monitoring and alerting,"Milos Hauskrecht, Iyad Batal, Michal Valko, Shyam Visweswaran, Gregory F. Cooper, Gilles Clermont",62,health,likelihood
2013,Anomaly Detection in Medical Wireless Sensor Networks,"Osman Salem, Yaning Liu, Ahmed Mehaoua",21,sense,likelihood
2013,Distributed anomaly detection for industrial wireless sensor networks based on fuzzy data modelling,"Heshan Kumarage, Ibrahim Khalil, Zahir Tari, Albert Y. Zomaya",37,sense,cluster
2013,Multiscale Anomaly Detection Using Diffusion Maps,"Gal Mishne, Israel Cohen",25,gis,model
2013,Anomaly Detection in Time Series of Graphs using Fusion of Graph Invariants,"Youngser Park, Carey E. Priebe, Abdou Youssef",27,cross,n/a
2013,Efficient Computer Network Anomaly Detection by Changepoint Detection Methods,"Alexander G. Tartakovsky, Aleksey S. Polunchenko, Grigory Sokolov",75,ids,likelihood
2013,Context-Aware Activity Recognition and Anomaly Detection in Video,"Yingying Zhu, Nandita M. Nayak, Amit K. Roy-Chowdhury",60,remote,similarity
2013,SVDD-based outlier detection on uncertain data,"Bo Liu, Yanshan Xiao, Longbing Cao, Zhifeng Hao, Feiqi Deng",74,cross,model
2013,Anomaly intrusion detection based on PLS feature extraction and core vector machine,"Xusheng Gan, Jing-shun Duanmu, Jia-fu Wang, Wei Cong",39,ids,model
2013,Outlier detection on uncertain data based on local information,"Jing Liu, Huifang Deng",23,cross,similarity
2013,Moving Object Detection by Detecting Contiguous Outliers in the Low-Rank Representation,"Xiaowei Zhou, Can Yang, Weichuan Yu",342,remote,model
2013,On-line anomaly detection and resilience in classifier ensembles,"Hesam Sagha, Hamidreza Bayati, José del R. Millán, Ricardo Chavarriaga",26,cross,model
2013,Using Low Resolution Satellite Imagery for Yield Prediction and Yield Anomaly Detection,"Felix Rembold, Clement Atzberger, Igor V. Savin, Oscar Rojas",130,remote,n/a
2013,FTDA: outlier detection-based fault-tolerant data aggregation for wireless sensor networks,"Suat Ozdemir, Yang Xiao",27,sense,similarity
2013,Advancements of Data Anomaly Detection Research in Wireless Sensor Networks: A Survey and Open Issues,"Murad A. Rassam, Anazida Zainal, Mohd Aizaini Maarof",35,sense,n/a
2013,Research issues in outlier detection for data streams,"Md. Shiblee Sadik, Le Gruenwald",31,cross,n/a
2013,Ensembles for unsupervised outlier detection: challenges and research questions a position paper,"Arthur Zimek, Ricardo J. G. B. Campello, Jörg Sander",94,cross,n/a
2013,Advancements of Outlier Detection: A Survey,Ji Zhang,57,cross,n/a
2013,Anomaly Detection Based Secure In-Network Aggregation for Wireless Sensor Networks,"Bo Sun, Xuemei Shan, Kui Wu, Yang Xiao",54,sense,likelihood
2013,MedMon: Securing Medical Devices Through Wireless Monitoring and Anomaly Detection,"Meng Zhang, Anand Raghunathan, Niraj K. Jha",54,sense,rule
2013,AutoGAD: An Improved ICA-Based Hyperspectral Anomaly Detection Algorithm,"Robert J. Johnson, Jason P. Williams, Kenneth W. Bauer Jr.",23,remote,model
2013,Models and Methods for Automated Background Density Estimation in Hyperspectral Anomaly Detection,"Stefania Matteoli, Tiziana Veracini, Marco Diani, Giovanni Corsini",33,remote,likelihood
2013,A Compressed PCA Subspace Method for Anomaly Detection in High-Dimensional Data,"Qi Ding, Eric D. Kolaczyk",33,cross,model
2013,Anomaly Detection via Online Oversampling Principal Component Analysis,"Yuh-Jye Lee, Yi-Ren Yeh, Yu-Chiang Frank Wang",105,cross,model
2013,Information-Theoretic Outlier Detection for Large-Scale Categorical Data,"Shu Wu, Shengrui Wang",70,cross,frequency
2013,Scalable Hypergrid k-NN-Based Online Anomaly Detection in Wireless Sensor Networks,"Miao Xie, Jiankun Hu, Song Han, Hsiao-Hwa Chen",60,sense,similarity
2013,Online Anomaly Detection for Hard Disk Drives Based on Mahalanobis Distance,"Yu Wang, Qiang Miao, Eden W. M. Ma, Kwok-Leung Tsui, Michael G. Pecht",41,fault,likelihood
2013,"A scalable, non-parametric anomaly detection framework for Hadoop","Li Yu, Zhiling Lan",21,fault,cluster
2013,Network traffic anomaly detection using clustering techniques and performance comparison,"Duo Liu, Chung-Horng Lung, Ioannis Lambadaris, Nabil Seddigh",21,ids,cluster
